{
  "slug": "lipid-profile",
  "status": "active",
  "name_pl": "Lipidogram",
  "name_en": "Lipid profile",
  "summary_pl": "Badanie krwi oceniające cholesterol całkowity, LDL, HDL i triglicerydy. W programie Moje Zdrowie należy do podstawowego zakresu badań dla każdej osoby od 20. roku życia, która wypełni ankietę.",
  "summary_en": "A blood test measuring total, LDL and HDL cholesterol and triglycerides. In the Moje Zdrowie program it is part of the basic test panel for everyone from age 20 who fills in the questionnaire.",
  "how_to_access_pl": "Lipidogram jest wykonywany w ramach bilansu zdrowia Moje Zdrowie. Wypełnij ankietę programu Moje Zdrowie na Internetowym Koncie Pacjenta, w aplikacji mojeIKP lub w swojej przychodni POZ; przychodnia wystawia na jej podstawie zlecenie na badania, więc skierowanie nie jest potrzebne. Skonsultuj się z lekarzem POZ.",
  "how_to_access_en": "The lipid profile is done as part of the Moje Zdrowie health check. Fill in the Moje Zdrowie questionnaire in the Internetowe Konto Pacjenta (IKP), the mojeIKP app or at your POZ clinic; the clinic issues the test order based on it, so no referral is needed. Consult your POZ (primary care) doctor.",
  "eligibility": [
    {
      "age_min": 20,
      "requires": []
    }
  ],
  "interval_kind": "per_program",
  "interval_months": null,
  "interval_overrides": [],
  "evidence_level": 2,
  "evidence_source": "Moje Zdrowie basic panel (Dz.U. 2025 poz. 584)",
  "burden_weight": 4,
  "nfz_funded": true,
  "referral_required": false,
  "sources": [
    {
      "url": "https://ezdrowie.gov.pl/portal/home/moje-zdrowie-bilans-zdrowia-dla-doroslych-w-poz",
      "title": "Moje Zdrowie – bilans zdrowia dla dorosłych w POZ",
      "publisher": "Centrum e-Zdrowia (ezdrowie.gov.pl)",
      "quote": "Zakres podstawowy badań laboratoryjnych (dla każdego) – obejmuje m.in. morfologię krwi, glukozę, lipidogram, kreatyninę (eGFR), TSH oraz ogólne badanie moczu.",
      "accessed": "2026-09-28"
    },
    {
      "url": "https://dziennikustaw.gov.pl/D2025000058401.pdf",
      "title": "Rozporządzenie Ministra Zdrowia z dnia 30 kwietnia 2025 r. zmieniające rozporządzenie w sprawie świadczeń gwarantowanych z zakresu podstawowej opieki zdrowotnej (Dz.U. 2025 poz. 584)",
      "publisher": "Dziennik Ustaw RP (Minister Zdrowia)",
      "quote": "4) lipidogram uwzględniający stężenie we krwi cholesterolu całkowitego, cholesterolu LDL, cholesterolu HDL, cholesterolu nie-HDL oraz triglicerydów;",
      "accessed": "2026-09-28"
    },
    {
      "url": "https://pacjent.gov.pl/program-moje-zdrowie",
      "title": "Program Moje Zdrowie",
      "publisher": "pacjent.gov.pl (Centrum e-Zdrowia)",
      "quote": "Ten bezpłatny program jest dla Ciebie od 20. roku życia. Obejmuje diagnostykę, porady zdrowotne oraz profilaktykę. Realizowany jest przez przychodnie podstawowej opieki zdrowotnej (POZ).",
      "accessed": "2026-09-28"
    },
    {
      "url": "https://pacjent.gov.pl/program-moje-zdrowie",
      "title": "Program Moje Zdrowie",
      "publisher": "pacjent.gov.pl (Centrum e-Zdrowia)",
      "quote": "Każda osoba, która rozpoczęła 20 rok życia i jest ubezpieczona w NFZ, może z niego skorzystać:",
      "accessed": "2026-09-28"
    },
    {
      "url": "https://pacjent.gov.pl/program-moje-zdrowie",
      "title": "Program Moje Zdrowie",
      "publisher": "pacjent.gov.pl (Centrum e-Zdrowia)",
      "quote": "Przychodnia POZ wystawi zlecenie (nie skierowanie) na badania na podstawie wypełnionej przez Ciebie ankiety.",
      "accessed": "2026-09-28"
    }
  ],
  "reviewed_by": null,
  "last_reviewed": null,
  "next_review_due": null
}
